"id","me","tema","enunciado","alternativa_a","alternativa_b","alternativa_c","alternativa_d","correta","explicacao"
"b515a242-3fd4-443a-855b-3c93eb12489a","ME3","Pós-Operatório","4o Trimestre ME3 - Em recuperação pós-anestésica, qual causa frequente de hipoxemia imediata deve ser considerada?","Hiperglicemia","Atelectasia","Hipocalcemia","Hipernatremia","B","Não é causa comum de dessaturação.

Correta. Atelectasia é frequente após anestesia geral.

Não é principal causa de hipoxemia.

Não possui relação direta."
"58c0f6a0-bee4-437f-a5c2-76872881d624","ME3","Obesidade","4o Trimestre ME3 - Em obesidade mórbida, qual alteração respiratória é comum?","Aumento da CRF","Redução da capacidade residual funcional","Hipocapnia obrigatória","Aumento da complacência torácica","B","A CRF geralmente reduz-se.

Correta. A redução da CRF favorece atelectasia e dessaturação.

Hipercapnia pode ocorrer.

A complacência geralmente reduz."
"fdb6e78a-5988-4c07-aff8-19a4407f9f39","ME3","Geriatria","4o Trimestre ME3 - Em pacientes idosos, qual princípio anestésico é adequado?","Mesmas doses de adultos jovens","Maior sensibilidade a anestésicos","Aumento obrigatório da MAC","Maior reserva fisiológica","B","Doses devem ser ajustadas.

Correta. O envelhecimento reduz reserva fisiológica e aumenta sensibilidade.

A MAC reduz-se com a idade.

A reserva fisiológica reduz-se."
"02f2c92c-3e68-45f1-99f6-3cbdf745c258","ME3","Anestesia Regional","4o Trimestre ME3 - Em anticoagulação com heparina de baixo peso molecular, qual cuidado é essencial antes de punção neuroaxial?","Ignorar intervalo farmacológico","Respeitar intervalo seguro entre dose e punção","Suspender monitorização","Realizar punção múltiplas vezes","B","Aumenta risco hemorrágico.

Correta. O intervalo reduz risco de hematoma neuraxial.

Monitorização continua obrigatória.

Punções repetidas aumentam trauma."
"5147298e-560b-4a43-b8c6-a99e627f7a50","ME3","Sedação","4o Trimestre ME3 - Em sedação fora do centro cirúrgico, qual princípio é fundamental?","Ausência de monitorização","Capacidade de resgate de via aérea","Uso obrigatório de anestesia geral","Suspensão de oximetria","B","Monitorização é obrigatória.

Correta. Segurança exige preparo para falência ventilatória.

Nem toda sedação exige anestesia geral.

Oximetria é essencial."
"4fd00369-d6a2-478a-8cb4-9fa15cda21de","ME3","Geriatria","4o Trimestre ME3 - Em paciente geriátrico, qual complicação cognitiva pode ocorrer após cirurgia?","Delirium pós-operatório","Hipercalcemia","Pneumotórax espontâneo","Bloqueio AV obrigatório","A","Correta. Delirium é frequente e multifatorial no idoso.

Não é principal complicação cognitiva.

Não possui relação direta.

Não é típico."
"a0a4bedd-17c4-47f7-9c65-30cd92ca06b6","ME3","Dor Aguda","4o Trimestre ME3 - Em analgesia pós-operatória multimodal, qual benefício principal ocorre?","Maior consumo de opioides","Redução da resposta neuroendócrina ao trauma","Hiperglicemia obrigatória","Maior incidência de NVPO","B","A analgesia multimodal reduz opioides.

Correta. O bloqueio nociceptivo reduz resposta inflamatória e simpática.

Não é benefício esperado.

NVPO tende a reduzir."
"88830b56-65c1-4e06-8075-94491f2e765b","ME3","Obesidade","4o Trimestre ME3 - Em anestesia bariátrica, qual estratégia ventilatória auxilia prevenção de atelectasia?","PEEP adequada","PEEP zero","Volume corrente elevado","Hiperventilação agressiva","A","Correta. PEEP reduz colapso alveolar perioperatório.

Favorece atelectasia.

Volumes elevados aumentam volutrauma.

Não previne colapso alveolar."
"0cf2676e-44a5-4a16-97b8-594edc2343cb","ME3","Geriatria","4o Trimestre ME3 - Qual alteração farmacodinâmica é comum no envelhecimento?","Menor sensibilidade a hipnóticos","Maior sensibilidade a opioides","Aumento da depuração renal","Aumento da massa magra","B","A sensibilidade geralmente aumenta.

Correta. Idosos apresentam maior resposta aos opioides.

A depuração renal reduz-se.

A massa magra tende a reduzir."
"eceeb406-e552-4315-9785-a71f17209250","ME3","Dor Crônica","4o Trimestre ME3 - Em dor crônica, qual fenômeno relaciona-se à amplificação persistente da dor?","Sensibilização central","Hipotermia","Hipocalcemia","Bloqueio neuromuscular","A","Correta. Alterações centrais amplificam percepção dolorosa.

Não é mecanismo principal.

Não possui relação direta.

Não se relaciona à dor crônica."
"bc34f3c3-422c-4eaa-b0f8-20c6ba121be2","ME3","Sedação","4o Trimestre ME3 - Em sedação profunda, qual complicação respiratória pode ocorrer?","Hiperventilação obrigatória","Obstrução de vias aéreas","Hipercalcemia","Broncodilatação persistente","B","Hipoventilação é mais provável.

Correta. Redução do tônus muscular favorece obstrução.

Não é complicação típica.

Não é efeito esperado."
"8e587678-dade-4bef-ba14-e7ec6dcb7a9e","ME3","Geriatria","4o Trimestre ME3 - Em delirium pós-operatório, qual estratégia ajuda prevenção?","Privação sensorial","Mobilização precoce","Sedação profunda contínua","Hipoventilação","B","Pode agravar delirium.

Correta. Mobilização reduz complicações cognitivas e funcionais.

Sedação profunda aumenta risco.

Não é estratégia preventiva."
"21818391-5637-46ed-a3b8-ce508d36673a","ME3","NVPO","4o Trimestre ME3 - Qual fator aumenta risco de náuseas e vômitos pós-operatórios?","Sexo masculino","Tabagismo","Uso de opioides","Idade avançada","C","Sexo feminino apresenta maior risco.

Tabagismo reduz risco relativo.

Correta. Opioides aumentam incidência de NVPO.

Pacientes jovens têm maior risco relativo."
"4c8b3c5e-5ba8-495c-b78e-a47644340d64","ME3","SAOS","4o Trimestre ME3 - Em paciente com síndrome da apneia obstrutiva do sono, qual risco pós-operatório é aumentado?","Hiperventilação","Depressão respiratória","Hipercalcemia","Hipertensão intracraniana","B","Não é característica típica.

Correta. Sensibilidade a sedativos e opioides aumenta eventos respiratórios.

Não possui relação direta.

Não é principal risco."
"3d012218-e9ab-4427-8fea-51a86de83094","ME3","Ambulatorial","4o Trimestre ME3 - Em anestesia ambulatorial, qual característica é desejável?","Recuperação prolongada","Baixa incidência de NVPO","Sedação residual intensa","Analgesia inadequada","B","Recuperação rápida é preferível.

Correta. Menor NVPO favorece alta precoce.

Sedação residual atrasa alta.

Analgesia inadequada é indesejável."
"f497aa7b-20c3-4e1e-a944-506407ca4bd8","ME3","Dor Crônica","4o Trimestre ME3 - Qual adjuvante analgésico atua por antagonismo NMDA?","Naloxona","Cetamina","Dexmedetomidina","Neostigmina","B","Naloxona antagoniza opioides.

Correta. Cetamina reduz sensibilização central.

Dexmedetomidina é agonista alfa-2.

Neostigmina é anticolinesterásico."
"86e4c84f-f54c-4562-8728-73a0d39e4f65","ME3","Cuidados Paliativos","4o Trimestre ME3 - Em cuidados paliativos, qual objetivo principal do manejo da dor?","Eliminar toda sedação","Melhorar qualidade de vida","Suspender opioides","Evitar analgesia multimodal","B","Sedação pode ser necessária em alguns casos.

Correta. Controle sintomático e conforto são prioridades.

Opioides frequentemente são necessários.

Analgesia multimodal pode ser útil."
"544ca060-7324-4069-b44b-4eded2372523","ME3","Dor Crônica","4o Trimestre ME3 - Em paciente em uso crônico de opioides, qual fenômeno pode ocorrer?","Hiperalgesia induzida por opioides","Analgesia permanente","Ausência total de tolerância","Redução absoluta da dor","A","Correta. Exposição prolongada pode aumentar sensibilidade dolorosa.

Não ocorre analgesia permanente.

Tolerância é frequente.

Dor pode persistir ou piorar."
"745dc267-a642-4854-add8-e7de17a871ea","ME3","NVPO","4o Trimestre ME3 - Qual antiemético atua predominantemente em receptores 5-HT3?","Droperidol","Ondansetrona","Escopolamina","Haloperidol","B","Droperidol atua principalmente em dopamina.

Correta. Ondansetrona antagoniza receptores serotoninérgicos 5-HT3.

Escopolamina é antimuscarínica.

Haloperidol atua em receptores dopaminérgicos."
"ab891fb0-b337-46e9-99c8-02b162f02313","ME3","SAOS","4o Trimestre ME3 - Qual estratégia reduz risco de depressão respiratória pós-operatória em pacientes com SAOS?","Uso liberal de opioides","Analgesia multimodal","Sedação contínua profunda","Hipoventilação permissiva","B","Aumenta risco respiratório.

Correta. Redução de opioides diminui eventos respiratórios.

Sedação profunda aumenta risco.

Não é estratégia adequada."
"cb5b7599-dd3d-43d3-b5a4-c02bdf823386","ME3","Ambulatorial","4o Trimestre ME3 - Em anestesia ambulatorial, qual agente possui perfil favorável para alta rápida?","Halotano","Desflurano","Morfina em altas doses","Tiopental contínuo","B","Halotano apresenta recuperação lenta.

Correta. Baixa solubilidade favorece despertar rápido.

Altas doses prolongam recuperação.

Acúmulo prolonga sedação."
"07857f5d-2ed8-4a81-aed2-83d5411b46b9","ME3","Dor Neuropática","4o Trimestre ME3 - Em paciente com dor neuropática, qual característica é comum?","Dor em choque elétrico","Dor exclusivamente nociceptiva","Ausência de alodinia","Analgesia completa com dipirona isolada","A","Correta. Queimação e choque elétrico são típicos.

Dor neuropática possui mecanismo distinto.

Alodinia pode ocorrer.

Frequentemente exige abordagem multimodal."
"83b59783-15b9-4835-994e-a3b354e550b1","ME3","Cuidados Paliativos","4o Trimestre ME3 - Em paciente terminal com dor intensa refratária, opioides fortes são:","Contraindicados","Frequentemente indicados","Substituídos sempre por AINE","Ineficazes","B","São amplamente utilizados.

Correta. Opioides são pilares no controle de dor intensa.

AINE isolado pode ser insuficiente.

São eficazes quando bem titulados."
"ff886aa7-1327-44d1-9289-9e5762dfe5a0","ME3","Ambulatorial","4o Trimestre ME3 - Em anestesia ambulatorial, qual fator favorece alta segura?","Controle adequado da dor","Sedação residual intensa","Náuseas persistentes","Hipoxemia","A","Correta. Analgesia adequada facilita recuperação e alta.

Sedação residual impede alta.

NVPO persistente contraindica alta.

Hipoxemia requer investigação."
"e958fcb3-2509-48b3-827b-0d4e8d36e743","ME3","Obesidade","4o Trimestre ME3 - Em paciente obeso mórbido, qual posição otimiza pré-oxigenação e intubação?","Trendelenburg","Posição em rampa","Litotomia","Prona","B","Trendelenburg piora mecânica ventilatória.

Correta. A posição em rampa melhora alinhamento anatômico.

Não melhora via aérea.

Não é utilizada para indução."
"a5dee754-0edb-4c8e-a67d-8a627128d07e","ME3","Geriatria","4o Trimestre ME3 - Em delirium pós-operatório no idoso, qual fator aumenta risco?","Privação do sono","Analgesia adequada","Mobilização precoce","Orientação frequente","A","Correta. Distúrbios do sono contribuem para delirium.

Analgesia adequada reduz estresse.

Mobilização reduz complicações.

Orientação reduz delirium."
"c4da4beb-5df6-4dcd-b40b-0f6a4f7ce4bf","ME3","Anestesia Regional","4o Trimestre ME3 - Em paciente anticoagulado, qual complicação grave pode ocorrer após bloqueio neuroaxial?","Hipoglicemia","Hematoma epidural","Broncoespasmo","Hipercalcemia","B","Não é complicação típica.

Correta. Compressão medular pode causar déficit neurológico permanente.

Não é principal complicação.

Não possui relação direta."
"c1b0c2c9-fe31-4c1f-b483-d7f556c8cfa6","ME3","PCA","4o Trimestre ME3 - Em analgesia controlada pelo paciente (PCA), qual vantagem principal ocorre?","Maior variabilidade analgésica","Autonomia do paciente na analgesia","Ausência de monitorização","Eliminação de efeitos adversos","B","O objetivo é reduzir variabilidade.

Correta. PCA permite titulação individual da analgesia.

Monitorização continua necessária.

Efeitos adversos ainda podem ocorrer."
"675a3d07-ff61-401c-9333-ce9fa3e77a6c","ME3","Sedação","4o Trimestre ME3 - Em anestesia para procedimentos fora do centro cirúrgico, qual monitorização mínima é obrigatória?","Somente ECG","Oximetria e monitorização ventilatória","PIC contínua","Débito cardíaco invasivo","B","Insuficiente isoladamente.

Correta. Oxigenação e ventilação devem ser continuamente avaliadas.

Não é rotina obrigatória.

Não é necessária rotineiramente."
"444c1fbe-b341-494b-b988-8a3ceb5ffaf0","ME3","SAOS","4o Trimestre ME3 - Em paciente com SAOS, opioides devem ser utilizados com:","Doses elevadas obrigatórias","Cautela","Ausência de monitorização","Hipoventilação permissiva","B","Aumentam risco respiratório.

Correta. SAOS aumenta sensibilidade à depressão respiratória.

Monitorização é essencial.

Hipoventilação é indesejável."
"1834687f-7eaa-4d29-a75a-d3682f573532","ME3","Bloqueio Residual","4o Trimestre ME3 - Em recuperação pós-anestésica, qual complicação respiratória é frequentemente relacionada ao bloqueio neuromuscular residual?","Broncodilatação","Hipoventilação e obstrução de vias aéreas","Hiperglicemia","Hipertensão intracraniana","B","Não é complicação típica.

Correta. Fraqueza muscular residual compromete ventilação e proteção de vias aéreas.

Não possui relação direta.

Não é principal consequência."
"7f7014b8-f0ec-48c7-b0cc-9881fcdd6526","ME3","Ambulatorial","4o Trimestre ME3 - Em anestesia ambulatorial, qual característica favorece alta precoce?","Recuperação prolongada","Baixa incidência de NVPO","Sedação residual","Analgesia inadequada","B","Retarda alta.

Correta. Menor incidência de NVPO melhora recuperação.

Retarda alta.

Impede alta segura."
"a85aca60-08a5-4d00-b6be-8abc786e03db","ME3","Dor Neuropática","4o Trimestre ME3 - Em dor neuropática, qual sintoma é característico?","Dor em choque elétrico","Dor exclusivamente somática","Ausência de alodinia","Analgesia completa com dipirona","A","Correta. Queimação e choque elétrico sugerem dor neuropática.

A fisiopatologia é diferente.

Alodinia pode estar presente.

Frequentemente é insuficiente."
"4f9a1e6f-f42b-4ebb-9eeb-0e1ebfa0e4c4","ME3","Cuidados Paliativos","4o Trimestre ME3 - Em paciente terminal, qual objetivo principal dos cuidados paliativos?","Prolongar vida a qualquer custo","Melhorar qualidade de vida","Suspender opioides","Evitar analgesia","B","Nem sempre é o foco principal.

Correta. Controle sintomático e conforto são prioridades.

Opioides frequentemente são necessários.

Analgesia é fundamental."
"20b98d9e-f6cf-475e-8418-59edcf7ed8db","ME3","NVPO","4o Trimestre ME3 - Qual fator aumenta risco de NVPO?","Tabagismo","Sexo masculino","Sexo feminino","Idade avançada","C","Tabagismo reduz risco relativo.

Homens têm menor incidência.

Correta. Sexo feminino é importante fator de risco.

Pacientes jovens apresentam maior risco relativo."
"542a67e0-7ad6-4a71-a278-0b87e35cad96","ME3","Opioides","4o Trimestre ME3 - Em paciente em uso crônico de opioides, qual fenômeno pode dificultar analgesia pós-operatória?","Tolerância opioide","Ausência de sensibilização","Analgesia permanente","Redução absoluta da dor","A","Correta. Necessidades analgésicas podem aumentar.

Sensibilização pode ocorrer.

Não ocorre permanentemente.

A dor pode persistir."
"f61a6bb2-5cb4-46e0-bece-b9b51531fc7f","ME3","Dor Aguda","4o Trimestre ME3 - Em analgesia regional no pós-operatório, qual benefício importante ocorre?","Maior consumo de opioides","Redução da resposta ao estresse cirúrgico","Hiperglicemia obrigatória","Aumento de delirium","B","Geralmente reduz opioides.

Correta. Bloqueio neural reduz descarga simpática e inflamatória.

Não é benefício esperado.

Pode até reduzir delirium ao melhorar analgesia."
"0890c12e-9528-4cca-b94b-c54603341dc9","ME3","Bloqueio Neuromuscular","4o Trimestre ME3 - Qual TOF ratio é recomendado antes da extubação?","0,5","0,7","0,9 ou maior","0,3","C","Ainda há risco de bloqueio residual.

Pode persistir fraqueza muscular.

Correta. TOF >0,9 reduz complicações respiratórias pós-operatórias.

Bloqueio importante ainda presente."
"7ba77b30-5213-4ebe-a09b-37427e6a1dd3","ME3","Halogenados","4o Trimestre ME3 - Qual agente inalatório possui recuperação mais rápida?","Halotano","Isoflurano","Desflurano","Metoxiflurano","C","Maior solubilidade prolonga recuperação.

Mais lento que desflurano.

Correta. Baixo coeficiente sangue:gás favorece despertar rápido.

Muito solúvel."
"e6c6020c-50fd-43d0-ba40-8a29a33952e8","ME3","Farmacologia","4o Trimestre ME3 - Qual fármaco possui ação agonista alfa-2 com sedação e analgesia?","Cetamina","Dexmedetomidina","Naloxona","Flumazenil","B","Cetamina antagoniza NMDA.

Correta. Dexmedetomidina promove sedação cooperativa.

Naloxona antagoniza opioides.

Flumazenil antagoniza benzodiazepínicos."
"f7354ad5-ca4e-43f3-8572-957373593f76","ME3","Oncologia","4o Trimestre ME3 - Em dor oncológica intensa, qual classe farmacológica frequentemente é necessária?","Opioides fortes","Somente AINE","Antibióticos","Antiarrítmicos","A","Correta. Opioides são pilares no tratamento da dor intensa.

Frequentemente insuficiente isoladamente.

Não tratam dor.

Não possuem indicação analgésica principal."
"671d8871-32fa-4085-9862-21ade7aeaa94","ME3","NVPO","4o Trimestre ME3 - Qual antiemético atua principalmente em receptores dopaminérgicos?","Ondansetrona","Droperidol","Escopolamina","Dexametasona","B","Atua em 5-HT3.

Correta. Droperidol antagoniza receptores dopaminérgicos.

Escopolamina é antimuscarínica.

Mecanismo antiemético é multifatorial."
"6e084118-a533-4dfa-a61e-f363001a94a8","ME3","Opioides","4o Trimestre ME3 - Qual fenômeno relaciona-se ao aumento paradoxal da sensibilidade dolorosa por opioides?","Hiperalgesia induzida por opioides","Bloqueio simpático","Tolerância cruzada","Sedação residual","A","Correta. Exposição prolongada pode aumentar percepção dolorosa.

Não é mecanismo principal.

Não define hiperalgesia.

Não explica dor aumentada."
"78601506-08e8-40e5-ac48-2a3b0d7fcd45","ME3","Geriatria","4o Trimestre ME3 - Em paciente geriátrico, qual alteração farmacocinética é frequente?","Aumento da depuração renal","Redução da água corporal total","Aumento da massa magra","Redução da sensibilidade a opioides","B","A depuração renal tende a reduzir.

Correta. Menor água corporal altera volume de distribuição.

A massa magra reduz-se.

Sensibilidade geralmente aumenta."
"c8de0ee6-700e-4d97-9379-876454616bfb","ME3","SAOS","4o Trimestre ME3 - Em pacientes com SAOS, qual estratégia reduz risco respiratório pós-operatório?","Uso liberal de opioides","Analgesia multimodal","Sedação contínua profunda","Hipoventilação permissiva","B","Aumenta depressão respiratória.

Correta. Reduz necessidade de opioides.

Aumenta risco de obstrução.

Não é recomendada."
"6e0a1e4d-0a16-43af-878d-515a42974a53","ME3","PCA","4o Trimestre ME3 - Em PCA com opioides, qual complicação deve ser monitorada?","Hipercalcemia","Depressão respiratória","Hipertensão intracraniana","Hiperglicemia","B","Não é complicação típica.

Correta. Opioides podem causar hipoventilação.

Não é principal complicação.

Não é principal complicação."
"705fa49f-c25b-4f1b-b3fa-33fed762862f","ME3","Anestesia Regional","4o Trimestre ME3 - Em bloqueio neuroaxial de paciente anticoagulado, qual complicação é mais temida?","Hipoglicemia","Hematoma epidural","Broncoespasmo","Hipocalcemia","B","Não é complicação típica.

Correta. Compressão medular pode gerar déficit irreversível.

Não é principal risco.

Não é complicação relevante nesse contexto."
"dd443245-b431-412a-8b6c-ae009ce0cc1f","ME3","Ambulatorial","4o Trimestre ME3 - Em anestesia ambulatorial, qual condição contraindica alta imediata?","Controle adequado da dor","Hipoxemia persistente","Náusea ausente","Mobilização adequada","B","Favorece alta.

Correta. Dessaturação exige investigação e tratamento.

Favorece alta.

Favorece alta."
"29b4ce57-6e77-4b08-a8aa-dc05adc5001d","ME3","Sedação","4o Trimestre ME3 - Em sedação procedural, qual monitorização ventilatória é altamente recomendada?","Capnografia","Somente ECG","Somente temperatura","Apenas PVC","A","Correta. Detecta precocemente hipoventilação e apneia.

ECG isolado é insuficiente.

Temperatura não avalia ventilação.

PVC não monitora ventilação."
"74a4e225-1c9f-4c41-a16a-ffc3f158666a","ME3","Geriatria","4o Trimestre ME3 - Em idosos, a MAC dos anestésicos inalatórios tende a:","Aumentar","Permanecer inalterada","Reduzir","Duplicar","C","A idade reduz necessidade anestésica.

Não permanece fixa.

Correta. O envelhecimento reduz a concentração alveolar mínima necessária.

Não ocorre."
"4f36f65a-a361-42f6-ad45-541e1577aa0f","ME3","Obesidade","4o Trimestre ME3 - Em paciente obeso mórbido, qual complicação respiratória pós-operatória é frequente?","Hiperventilação","Hipoxemia por atelectasia","Hipocapnia","Broncodilatação","B","Hipoventilação é mais comum.

Correta. Redução da CRF favorece atelectasia.

Hipercapnia pode ocorrer.

Não é típica."
"878c0f3d-a515-4f04-86c5-e9b53dfb2653","ME3","Sedação","4o Trimestre ME3 - Em sedação fora do centro cirúrgico, qual equipamento deve estar disponível?","Apenas oxímetro","Material para manejo de via aérea","Somente ECG","Apenas desfibrilador","B","Insuficiente isoladamente.

Correta. Deve haver capacidade imediata de resgate ventilatório.

Monitorização isolada não basta.

Desfibrilador é importante, mas insuficiente isoladamente."
"20f76c71-6c4b-4aae-a4b3-f3fe482bbbd3","ME3","Anestesia Regional","4o Trimestre ME3 - Em uso de HBPM, antes de punção neuroaxial deve-se:","Ignorar intervalo da última dose","Respeitar intervalo seguro","Suspender monitorização","Utilizar agulhas traumáticas","B","Aumenta risco hemorrágico.

Correta. O intervalo reduz risco de hematoma neuraxial.

Monitorização continua necessária.

Punção traumática aumenta risco."
"251bc873-7554-4c91-8a4e-830fa6e06372","ME3","Cardiovascular","4o Trimestre ME3 - Em paciente idoso, qual alteração cardiovascular é frequente?","Aumento da complacência vascular","Redução da complacência vascular","Aumento intenso da resposta beta","Maior reserva cardíaca","B","A complacência reduz-se com envelhecimento.

Correta. Rigidez vascular aumenta pós-carga.

A resposta beta-adrenérgica reduz-se.

A reserva fisiológica reduz-se."
"aa4c644d-641c-4281-a2ac-5d8ef10296aa","ME3","Geriatria","4o Trimestre ME3 - Em delirium pós-operatório, qual medida auxilia prevenção?","Privação do sono","Orientação frequente e mobilização precoce","Sedação profunda contínua","Isolamento prolongado","B","Privação do sono aumenta risco.

Correta. Medidas não farmacológicas reduzem delirium.

Sedação profunda favorece delirium.

Isolamento pode piorar quadro cognitivo."
"c5653c89-7c04-4eab-81b7-f7dc17397546","ME3","Dor Aguda","4o Trimestre ME3 - Em analgesia multimodal, qual classe reduz consumo de opioides?","AINEs","Somente benzodiazepínicos","Antibióticos","Bloqueadores neuromusculares","A","Correta. AINEs possuem efeito poupador de opioides.

Não são analgésicos principais.

Não possuem ação analgésica relevante.

Não tratam dor."
"390440a8-721d-4b73-8d60-82adaafca6e7","ME3","Sedação","4o Trimestre ME3 - Em sedação profunda, qual complicação é mais provável?","Hiperventilação","Obstrução de vias aéreas","Hipercalcemia","Hipotermia grave obrigatória","B","Hipoventilação é mais comum.

Correta. Redução do tônus faríngeo favorece obstrução.

Não é complicação típica.

Não é obrigatória."
"d7d47cce-fa75-4ebc-a918-5aa9d419ddff","ME3","SRPA","4o Trimestre ME3 - Em recuperação pós-anestésica, qual escala é frequentemente utilizada para alta?","Mallampati","Aldrete-Kroulik","Ramsay","APACHE II","B","Avalia via aérea.

Correta. Avalia critérios de recuperação pós-anestésica.

Avalia sedação.

É escore prognóstico de UTI."
"9838c601-4faf-4f8f-8b60-29f663db4815","ME3","Cardiovascular","4o Trimestre ME3 - Em idosos, hipotensão perioperatória pode ser mais frequente devido a:","Maior reserva autonômica","Redução da resposta barorreflexa","Aumento obrigatório da volemia","Hipercalcemia","B","A reserva autonômica reduz-se.

Correta. A resposta compensatória cardiovascular é menos eficiente.

Não é principal mecanismo.

Não possui relação direta."
"d620a205-8fa1-43a1-962d-ddf2c05eccb4","ME3","Geriatria","4o Trimestre ME3 - Em paciente geriátrico, qual complicação pulmonar pós-operatória é comum?","Atelectasia","Hiperventilação persistente","Broncodilatação","Hipocalcemia","A","Correta. Redução da reserva pulmonar aumenta complicações respiratórias.

Hipoventilação é mais comum.

Não é complicação típica.

Não possui relação direta."
"08959c13-a839-4b62-b478-b6a5be83aa37","ME3","SRPA","4o Trimestre ME3 - Em recuperação pós-anestésica, qual fator aumenta risco de obstrução de vias aéreas superiores?","Bloqueio neuromuscular residual","Hipervolemia","Hipercalcemia","Hiperglicemia","A","Correta. Fraqueza da musculatura faríngea favorece obstrução.

Não é principal causa.

Não possui relação direta.

Não é causa típica."
"e1e6a430-58b7-4f86-93bf-9fa85b3bf646","ME3","Ambulatorial","4o Trimestre ME3 - Em anestesia ambulatorial, qual condição favorece alta?","Dor controlada","Hipoxemia persistente","Vômitos incoercíveis","Instabilidade hemodinâmica","A","Correta. Controle da dor é requisito para alta segura.

Contraindica alta.

Impede alta.

Impede alta."
