"id","me","tema","enunciado","alternativa_a","alternativa_b","alternativa_c","alternativa_d","correta","explicacao"
"cc54e749-5aa1-42cf-8267-5cb85d16b7fe","ME3","Feocromocitoma","2o Trimestre ME3 - Em anestesia para feocromocitoma, qual evento ocorre frequentemente após retirada tumoral?","Hipertensão grave","Hipotensão importante","Broncoespasmo","Hipercalcemia","B","Após ressecção tumoral há redução catecolaminérgica.

Correta. A perda do estímulo vasoconstritor favorece hipotensão.

Broncoespasmo não é típico.

Hipocalcemia não é principal alteração."
"fcec0437-eb07-4e5b-951e-5194b0e53ddc","ME3","Queimado","2o Trimestre ME3 - Em paciente queimado após 48 horas, succinilcolina aumenta risco de:","Hipocalcemia","Hipercalemia grave","Hiponatremia","Acidose metabólica","B","Hipocalcemia não é principal complicação.

Correta. Há proliferação de receptores nicotínicos extrajuncionais.

Hiponatremia não é típica.

Acidose pode coexistir, mas não é principal risco."
"b7a1f52f-7c1b-45d5-b594-4e8dba23087e","ME3","Hipertermia Maligna","2o Trimestre ME3 - Em hipertermia maligna, qual sinal costuma surgir precocemente?","Hipocapnia","Elevação progressiva do ETCO2","Hipotermia","Bradicardia","B","Hipocapnia não é típica.

Correta. O hipermetabolismo aumenta produção de CO2 rapidamente.

Hipotermia não ocorre.

Taquicardia é mais frequente."
"3d7712c7-7204-497b-b041-6096e7d62d39","ME3","Ventilação","2o Trimestre ME3 - Em ventilação protetora, qual volume corrente geralmente é recomendado na SDRA?","12 mL/kg","10 mL/kg","6 mL/kg","15 mL/kg","C","Volumes elevados aumentam volutrauma.

Ainda acima do ideal.

Correta. Baixos volumes reduzem lesão pulmonar.

Volumes excessivos aumentam mortalidade."
"eda4c695-72f5-4fd1-b7c4-5ed3b213b85f","ME3","Embolia","2o Trimestre ME3 - Em embolia pulmonar maciça, qual alteração hemodinâmica ocorre frequentemente?","Aumento do débito do VD","Falência ventricular direita aguda","Redução da pressão pulmonar","Hipervolemia","B","O débito do VD reduz-se.

Correta. O aumento abrupto da pós-carga sobrecarrega o VD.

A pressão pulmonar eleva-se.

Hipervolemia não é típica."
"374a1ca9-e0d2-432f-ae38-3c23fc5ae462","ME3","Hipertensão Pulmonar","2o Trimestre ME3 - Em paciente com hipertensão pulmonar, qual alteração aumenta resistência vascular pulmonar?","Hipocapnia","Alcalose","Hipóxia","Normotermia","C","Hipocapnia reduz RVP.

Alcalose geralmente reduz RVP.

Correta. Hipóxia promove vasoconstrição pulmonar.

Normotermia é desejável."
"b408b9a5-a018-4714-b4ec-97110b44f443","ME3","Hipertensão Pulmonar","2o Trimestre ME3 - Em hipertensão pulmonar grave, qual condição deve ser evitada rigorosamente?","Normotermia","Hipercapnia","Analgesia adequada","Normovolemia","B","Normotermia é desejável.

Correta. Hipercapnia aumenta resistência vascular pulmonar.

Analgesia reduz descarga simpática.

Normovolemia é importante."
"3452a837-8583-40d9-80f2-c8249e7cda9c","ME3","Sepse","2o Trimestre ME3 - Em choque séptico refratário, qual mecanismo contribui para vasoplegia persistente?","Deficiência relativa de vasopressina","Redução de óxido nítrico","Hipercalcemia","Aumento da responsividade alfa","A","Correta. A deficiência relativa de vasopressina contribui para hipotensão refratária.

Óxido nítrico geralmente encontra-se aumentado.

Hipocalcemia pode coexistir.

A responsividade vascular costuma estar reduzida."
"07b913ec-253a-4276-8b51-7802a68604b6","ME3","Laparoscopia","2o Trimestre ME3 - Em cirurgia laparoscópica prolongada, qual alteração fisiológica ocorre frequentemente?","Redução da PaCO2","Hipocapnia obrigatória","Aumento da pressão de vias aéreas","Redução da pressão intra-abdominal","C","A PaCO2 geralmente aumenta.

Hipocapnia não é esperada.

Correta. O pneumoperitônio reduz complacência pulmonar.

A pressão abdominal aumenta."
"93d44777-589e-41c0-9b6b-5d986f25bec5","ME3","Neurocrítico","2o Trimestre ME3 - Em paciente com hipertensão intracraniana, qual solução deve ser evitada?","Soro fisiológico","Salina hipertônica","Glicose 5%","Albumina isotônica","C","SF é frequentemente utilizado.

Salina hipertônica pode reduzir PIC.

Correta. Soluções hipotônicas favorecem edema cerebral.

Albumina pode ser usada em situações específicas."
"01df887c-6f34-43e5-962b-ef78125bbc0d","ME3","Anestesia Regional","2o Trimestre ME3 - Em anestesia regional guiada por ultrassom, qual benefício principal ocorre?","Eliminação total de complicações","Maior visualização anatômica","Ausência de LAST","Dispensa monitorização","B","Complicações ainda podem ocorrer.

Correta. O ultrassom permite visualização em tempo real.

LAST ainda pode ocorrer.

Monitorização continua obrigatória."
"e801dff7-0146-4a76-984d-c903f9ef3f6d","ME3","Ventilação","2o Trimestre ME3 - Em ventilação mecânica, qual estratégia reduz atelectrauma?","PEEP adequada","PEEP zero","Volume corrente elevado","Hiperventilação intensa","A","Correta. PEEP reduz colapso alveolar cíclico.

PEEP zero favorece atelectasia.

Volumes altos aumentam volutrauma.

Hiperventilação não reduz atelectrauma."
"08566142-573a-4b20-b7af-209eb2bd790a","ME3","Ventilação","2o Trimestre ME3 - Em ventilação mecânica, qual condição aumenta pressão de platô?","Broncoespasmo isolado","Baixa complacência pulmonar","Obstrução parcial do TOT","Aumento isolado da resistência","B","Broncoespasmo aumenta principalmente pico.

Correta. Redução da complacência aumenta pressão alveolar estática.

Obstrução eleva pico predominantemente.

Resistência isolada eleva pico."
"18343890-f5d8-4fb6-b39b-a183f52046bd","ME3","Cirurgia Robótica","2o Trimestre ME3 - Em cirurgia robótica com Trendelenburg acentuado, qual alteração ocorre frequentemente?","Redução da PIC","Aumento da complacência pulmonar","Edema facial e aumento da PIC","Hipocapnia espontânea","C","Trendelenburg aumenta pressão venosa cerebral.

A complacência reduz-se.

Correta. O posicionamento favorece congestão venosa.

A PaCO2 geralmente aumenta."
"85c25e79-7844-411f-bda6-4a81742989bb","ME3","SDRA","2o Trimestre ME3 - Em paciente com SDRA grave, qual mecanismo é principal responsável pela hipoxemia refratária?","Espaço morto isolado","Shunt intrapulmonar","Hiperventilação","Redução do débito cardíaco","B","Espaço morto pode aumentar, mas não explica isoladamente.

Correta. Áreas não ventiladas permanecem perfundidas.

Hiperventilação não causa hipoxemia refratária.

Débito reduzido não é principal mecanismo."
"25616e01-dc0b-449b-9a85-29031ffb280c","ME3","Anestesia Regional","2o Trimestre ME3 - Em anestesia regional, qual medida reduz risco de injeção intravascular?","Injeção rápida","Aspiração frequente e injeção fracionada","Suspender monitorização","Uso de dose máxima","B","Injeção rápida aumenta risco de LAST.

Correta. A técnica fracionada reduz administração intravascular inadvertida.

Monitorização continua obrigatória.

Doses elevadas aumentam toxicidade."
"61edd425-18e3-429a-8045-ff49ae26f0ed","ME3","Monitorização","2o Trimestre ME3 - Em monitorização hemodinâmica avançada, qual parâmetro dinâmico prediz melhor responsividade volêmica?","PVC","PAM","Variação do volume sistólico","Temperatura central","C","PVC isolada possui baixa acurácia.

PAM não prediz responsividade.

Correta. Parâmetros dinâmicos apresentam maior valor preditivo.

Temperatura não avalia volemia."
"30c30c9f-d4b4-4117-94d5-6342f6a57b5e","ME3","Ventilação","2o Trimestre ME3 - Em ventilação protetora, qual valor de driving pressure associa-se a melhor prognóstico?","Elevada","Menor que 15 cmH2O","Maior que 25 cmH2O","Maior que 30 cmH2O","B","Driving pressure elevada aumenta mortalidade.

Correta. Menores pressões associam-se a menor lesão pulmonar.

Valores altos são deletérios.

Valores extremos associam-se a pior prognóstico."
"464bf8d9-9532-44c2-b31d-7761b65790b5","ME3","Ventilação","2o Trimestre ME3 - Em monitorização ventilatória, qual parâmetro melhor reflete ventilação alveolar?","FiO2","ETCO2","SpO2","PVC","B","FiO2 mede fração inspirada de oxigênio.

Correta. ETCO2 correlaciona-se com eliminação alveolar de CO2.

SpO2 avalia oxigenação.

PVC não avalia ventilação."
"c109068a-1c36-4a53-800e-8ef8064aec7d","ME3","Ventilação","2o Trimestre ME3 - Em ventilação mecânica, qual condição favorece auto-PEEP?","Tempo expiratório prolongado","Baixa frequência respiratória","Tempo expiratório insuficiente","Baixo volume corrente","C","Tempo expiratório longo reduz auto-PEEP.

FR baixa reduz hiperinsuflação.

Correta. Expiração incompleta causa aprisionamento aéreo.

Baixo volume reduz risco."
"16bf30d3-5484-4a5f-9265-4751541cbf89","ME3","Choque Hemorrágico","2o Trimestre ME3 - Em choque hemorrágico grave, qual marcador sugere hipoperfusão persistente?","SpO2","Lactato elevado","Hemoglobina normal","Hipocalcemia","B","SpO2 pode permanecer normal.

Correta. Lactato elevado reflete metabolismo anaeróbico.

Hemoglobina isolada não exclui choque.

Hipocalcemia não avalia perfusão."
"526a45aa-81e3-4129-8dc8-3bdae6e4da9b","ME3","Neurocirurgia","2o Trimestre ME3 - Em neurocirurgia na posição sentada, qual complicação deve ser monitorada?","Hipoglicemia","Embolia gasosa venosa","Hipocalcemia","Broncoespasmo","B","Hipoglicemia não é principal complicação.

Correta. O gradiente venoso favorece entrada de ar.

Hipocalcemia não é típica.

Broncoespasmo não é principal evento."
"561517f6-2a2b-4aa8-9d5a-ebacd368b616","ME3","Ventilação","2o Trimestre ME3 - Em ventilação mecânica, qual condição favorece volutrauma?","PEEP adequada","Volume corrente elevado","Hipercapnia permissiva","Ventilação protetora","B","PEEP adequada reduz lesão.

Correta. Distensão alveolar excessiva aumenta dano pulmonar.

Hipercapnia permissiva pode proteger pulmão.

Ventilação protetora reduz lesão."
"73b583f7-2c6d-4257-8f71-7185bfce01a1","ME3","Capnografia","2o Trimestre ME3 - Em ventilação mecânica, qual achado sugere reinalação de CO2?","Linha de base elevada","Capnograma ausente","Queda abrupta do ETCO2","ETCO2 zero","A","Correta. CO2 inspirado aumenta linha de base capnográfica.

Ausência sugere desconexão.

Queda abrupta sugere embolia ou desconexão.

ETCO2 zero não é compatível com ventilação efetiva."
"648fc1d6-ac66-452d-9b4d-80396f9703fa","ME3","Ventilação","2o Trimestre ME3 - Em ventilação mecânica, qual situação favorece atelectasia de absorção?","PEEP adequada","FiO2 elevada prolongada","Ventilação protetora","Mobilização precoce","B","PEEP reduz atelectasia.

Correta. Altas frações inspiradas favorecem colapso alveolar.

Ventilação protetora reduz colapso.

Mobilização reduz complicações pulmonares."
"b0a9a606-a6f5-43b7-bfb3-c74e40206978","ME3","Ventilação","2o Trimestre ME3 - Em ventilação mecânica, qual situação aumenta pressão de pico sem alterar significativamente a pressão de platô?","Broncoespasmo","SDRA","Edema pulmonar","Fibrose pulmonar","A","Correta. O aumento da resistência aérea eleva pressão de pico.

SDRA reduz complacência e eleva ambas.

Edema reduz complacência.

Fibrose aumenta platô e pico."
"0464de68-8048-4809-9622-bcbcae59b8ad","ME3","Neuroanestesia","2o Trimestre ME3 - Em neuroanestesia, qual medida reduz rapidamente a pressão intracraniana?","Hipercapnia","Hiperventilação temporária","Trendelenburg","PEEP elevada","B","Hipercapnia aumenta fluxo cerebral.

Correta. A redução da PaCO2 promove vasoconstrição cerebral transitória.

Trendelenburg piora drenagem venosa.

PEEP elevada pode aumentar PIC."
"2300ed62-01bc-4832-a96c-00392484d989","ME3","Obesidade","2o Trimestre ME3 - Em paciente obeso mórbido, qual estratégia otimiza intubação traqueal?","Trendelenburg","Posição em rampa","Litotomia","Prona","B","Trendelenburg piora mecânica respiratória.

Correta. A posição em rampa melhora alinhamento anatômico.

Litotomia não auxilia.

Prona não é utilizada para indução."
"08d2a5af-a267-4928-baa0-1cfe7b472ec1","ME3","Cirurgia Cardíaca","2o Trimestre ME3 - Em anestesia cardíaca, qual alteração ocorre frequentemente na circulação extracorpórea?","Hemoconcentração","Hemodiluição","Hipercalcemia","Aumento da viscosidade","B","O circuito extracorpóreo dilui componentes sanguíneos.

Correta. O prime da CEC reduz hematócrito e proteínas plasmáticas.

Hipocalcemia é mais comum.

A viscosidade tende a reduzir."
"0ae9a3ed-4509-4e97-b169-0a36b4548754","ME3","Posicionamento","2o Trimestre ME3 - Em cirurgia na posição prona prolongada, qual complicação ocular grave pode ocorrer?","Conjuntivite","Neuropatia óptica isquêmica","Glaucoma agudo","Descolamento de retina","B","Conjuntivite não é principal complicação.

Correta. Hipoperfusão ocular pode causar perda visual permanente.

Não é principal evento descrito.

Descolamento é raro."
"8aae6e7b-3b1a-40e4-b8f2-d8c8e5629e2f","ME3","Sepse","2o Trimestre ME3 - Em paciente séptico grave, qual vasopressor é primeira escolha?","Dobutamina","Nitroglicerina","Noradrenalina","Dopamina","C","Dobutamina é inotrópico adjuvante.

Nitroglicerina é vasodilatador.

Correta. Noradrenalina é o vasopressor inicial recomendado.

Dopamina possui maior risco arrítmico."
"940bd50e-b11f-4c95-8b6a-0d50e763c761","ME3","Feocromocitoma","2o Trimestre ME3 - Em anestesia para feocromocitoma, qual medicação é usada classicamente no preparo pré-operatório?","Fenilefrina","Fenoxibenzamina","Atropina","Nitroglicerina","B","Fenilefrina aumentaria vasoconstrição.

Correta. O bloqueio alfa reduz crises hipertensivas perioperatórias.

Atropina não possui essa finalidade.

Nitroglicerina é mais usada intraoperatoriamente."
"59a64ba0-f14d-423f-b39c-060142e11a4d","ME3","Asma","2o Trimestre ME3 - Em paciente asmático grave, qual agente venoso apresenta broncodilatação significativa?","Tiopental","Cetamina","Etomidato","Midazolam","B","Tiopental não possui broncodilatação relevante.

Correta. Cetamina possui efeito simpatomimético broncodilatador.

Etomidato é hemodinamicamente estável.

Midazolam não broncodilata significativamente."
"1391401a-c52d-4098-8b77-885a131b7acc","ME3","Transfusão","2o Trimestre ME3 - Em anestesia cardíaca, qual distúrbio eletrolítico ocorre frequentemente após transfusão maciça?","Hipercalcemia","Hipocalcemia","Hipermagnesemia","Hipernatremia","B","O citrato reduz cálcio ionizado.

Correta. Citrato dos hemoderivados pode causar hipocalcemia.

Hipermagnesemia não é principal alteração.

Hipernatremia não é típica."
"5ee0690f-3c52-490e-b5a6-b9a64ad319a1","ME3","Embolia Gasosa","2o Trimestre ME3 - Em embolia gasosa venosa, qual alteração ocorre frequentemente?","Elevação abrupta do ETCO2","Queda abrupta do ETCO2","Aumento da complacência","Hipertensão sustentada","B","O ETCO2 geralmente reduz-se.

Correta. A redução da perfusão pulmonar diminui eliminação de CO2.

A complacência pode reduzir-se.

Hipotensão é mais frequente."
"41399385-36fa-4c09-ade2-1ab2d354d72f","ME3","LAST","2o Trimestre ME3 - Em LAST, qual tratamento específico é recomendado?","Naloxona","Flumazenil","Emulsão lipídica intravenosa","Atropina","C","Naloxona antagoniza opioides.

Flumazenil antagoniza benzodiazepínicos.

Correta. Emulsão lipídica é terapia padrão na toxicidade sistêmica.

Atropina não trata LAST."
"55a8dd6d-3ba6-480b-b2c0-3e5c4f6f1ec7","ME3","Broncoespasmo","2o Trimestre ME3 - Em broncoespasmo intraoperatório grave, qual ajuste ventilatório é adequado?","Tempo expiratório curto","FR elevada","Tempo expiratório prolongado","Volume corrente elevado","C","Tempo curto favorece auto-PEEP.

FR elevada aumenta aprisionamento aéreo.

Correta. Expiração prolongada reduz hiperinsuflação dinâmica.

Volumes altos aumentam barotrauma."
"5126d049-39fc-4bb8-95a8-9e01039cd93d","ME3","Asma","2o Trimestre ME3 - Em paciente asmático grave, qual agente inalatório deve ser evitado?","Sevoflurano","Isoflurano","Desflurano","Halotano","C","Sevoflurano possui broncodilatação.

Isoflurano também broncodilata.

Correta. Desflurano irrita vias aéreas.

Halotano possui baixa pungência."
"f9944ad8-1381-4f89-b317-6c283937ad57","ME3","Obstetrícia","2o Trimestre ME3 - Em anestesia obstétrica, qual alteração fisiológica reduz tempo até dessaturação?","Aumento da CRF","Redução da capacidade residual funcional","Hipometabolismo","Redução do consumo de oxigênio","B","A CRF reduz-se na gestação.

Correta. Menor reserva pulmonar acelera dessaturação.

O metabolismo aumenta.

O consumo de O2 aumenta."
"e004ab7b-a402-4539-8f2f-1417e0e318f5","ME3","Capnografia","2o Trimestre ME3 - Em broncoespasmo grave, qual alteração capnográfica é típica?","Linha de base elevada","Curva em barbatana de tubarão","Capnograma ausente","ETCO2 zero","B","Linha de base elevada sugere reinalação.

Correta. O esvaziamento expiratório lento altera a fase III.

Traçado ausente sugere desconexão.

ETCO2 zero não é compatível com ventilação efetiva."
"32c54beb-02ff-4a48-ba69-bd20c02f5881","ME3","Ventilação","2o Trimestre ME3 - Em ventilação mecânica, qual alteração ocorre frequentemente com PEEP excessiva?","Aumento do retorno venoso","Redução da pré-carga","Hipervolemia","Aumento obrigatório da complacência","B","PEEP elevada pode reduzir débito cardíaco.

Correta. A pressão intratorácica elevada reduz retorno venoso.

Não causa hipervolemia.

A complacência pode piorar."
"00ec8ddf-117f-4090-8557-ee8f237438ad","ME3","Hipertensão Pulmonar","2o Trimestre ME3 - Em paciente com hipertensão pulmonar, qual condição aumenta pós-carga do ventrículo direito?","Hipocapnia","Hipóxia","Alcalose","Normotermia","B","Hipocapnia reduz resistência pulmonar.

Correta. Hipóxia causa vasoconstrição pulmonar.

Alcalose geralmente reduz RVP.

Normotermia é desejável."
"4608160b-36b9-4b65-9fa0-69c14ab7467e","ME3","Ventilação","2o Trimestre ME3 - Em ventilação mecânica, qual parâmetro corresponde à driving pressure?","Pressão de pico menos PEEP","Pressão de platô menos PEEP","ETCO2 menos PEEP","VC dividido pela FiO2","B","A pressão de pico sofre influência da resistência.

Correta. Driving pressure relaciona-se ao estresse alveolar.

ETCO2 não participa do cálculo.

Não corresponde ao conceito."
"5c289b9c-dcf9-4baf-a548-1b9c82d3c95b","ME3","DPOC","2o Trimestre ME3 - Em ventilação mecânica, qual ajuste reduz hiperinsuflação dinâmica no DPOC?","FR elevada","Tempo expiratório prolongado","Volume corrente elevado","Hiperventilação intensa","B","FR elevada favorece auto-PEEP.

Correta. Maior tempo expiratório reduz aprisionamento aéreo.

Volumes altos aumentam risco de barotrauma.

Hiperventilação agrava hiperinsuflação."
"7422789f-2540-4c97-a6c7-6506f859a482","ME3","SDRA","2o Trimestre ME3 - Em SDRA grave, qual estratégia ventilatória reduz lesão pulmonar induzida pela ventilação?","Volume corrente alto","Pressão de platô elevada","Volume corrente baixo e PEEP individualizada","Hiperventilação agressiva sem limite pressórico","C","Aumenta volutrauma.

Aumenta barotrauma.

Correta. Estratégia protetora reduz volutrauma e atelectrauma.

Pode agravar lesão pulmonar."
"5736da2c-95ac-49b2-b3fe-a54f862f4d9b","ME3","Capnografia","2o Trimestre ME3 - Em reinalação de CO2 no circuito anestésico, qual achado é esperado?","Linha de base capnográfica elevada","Traçado ausente","Queda abrupta do ETCO2","Capnograma normal obrigatório","A","Correta. CO2 inspirado impede retorno da linha de base ao zero.

Sugere desconexão.

Sugere embolia ou baixo débito.

Não ocorre obrigatoriamente."
"12f9e2a5-cce3-439d-8b24-3381d4be4021","ME3","Capnografia","2o Trimestre ME3 - Qual causa frequente de reinalação de CO2 no circuito circular?","Exaustão da cal sodada","Hiperventilação","Baixo metabolismo","Hipotermia","A","Correta. Absorvedor exaurido permite reinalação de CO2.

Reduz ETCO2.

Reduz produção de CO2.

Reduz produção metabólica de CO2."
"58b45ce8-b89e-4c72-a5a7-d6e5a81e42d8","ME3","Broncoespasmo","2o Trimestre ME3 - Em broncoespasmo intraoperatório grave, qual ajuste ventilatório é mais adequado?","Aumentar frequência respiratória","Reduzir tempo expiratório","Prolongar tempo expiratório","Aumentar volume corrente agressivamente","C","Piora auto-PEEP.

Aumenta aprisionamento aéreo.

Correta. Expiração prolongada reduz hiperinsuflação dinâmica.

Aumenta risco de barotrauma."
"74d5e439-f77e-467a-97f7-56412b2ea2cb","ME3","Ventilação","2o Trimestre ME3 - Em ventilação controlada a volume, aumento de pico com platô normal sugere:","Aumento de resistência de vias aéreas","Redução de complacência pulmonar","Pneumotórax hipertensivo sempre","Edema pulmonar cardiogênico","A","Correta. Resistência elevada aumenta pressão resistiva.

Aumentaria pico e platô.

Pode elevar ambos se reduzir complacência.

Geralmente aumenta platô também."
"5e69fa6b-7141-433c-9a91-37f27f17d329","ME3","Capnografia","2o Trimestre ME3 - Qual alteração capnográfica sugere broncoespasmo?","Linha de base elevada","Curva em barbatana de tubarão","Traçado ausente","ETCO2 zero persistente","B","Sugere reinalação de CO2.

Correta. Esvaziamento expiratório lento altera a fase III.

Sugere desconexão ou extubação.

Incompatível com ventilação efetiva."
"3d10d6cd-cdd7-4161-b98c-98f2d2b1cd2b","ME3","Embolia","2o Trimestre ME3 - Em embolia pulmonar maciça, qual achado capnográfico é esperado?","Aumento abrupto do ETCO2","Queda abrupta do ETCO2","Linha de base elevada","Aumento progressivo por hipermetabolismo","B","Não é típico.

Correta. Redução da perfusão pulmonar diminui eliminação de CO2.

Sugere reinalação.

Sugere hipertermia maligna."
"6d118a71-04e2-45e2-b55c-87750b32beb2","ME3","SDRA","3o Trimestre ME3 - Em SDRA grave, qual estratégia ventilatória reduz lesão pulmonar induzida pela ventilação?","Volume corrente alto","Pressão de platô elevada","Volume corrente baixo e PEEP individualizada","Hiperventilação agressiva sem limite pressórico","C","Aumenta volutrauma.

Aumenta barotrauma.

Correta. Estratégia protetora reduz volutrauma e atelectrauma.

Pode agravar lesão pulmonar."
"7cb3b881-b2b0-4d7b-a3ad-5a1dfaec441f","ME3","Capnografia","3o Trimestre ME3 - Em reinalação de CO2 no circuito anestésico, qual achado é esperado?","Linha de base capnográfica elevada","Traçado ausente","Queda abrupta do ETCO2","Capnograma normal obrigatório","A","Correta. CO2 inspirado impede retorno da linha de base ao zero.

Sugere desconexão.

Sugere embolia ou baixo débito.

Não ocorre obrigatoriamente."
"3997f71d-8ad3-4f9e-9425-af67dd53e6d3","ME3","SDRA","3o Trimestre ME3 - Qual driving pressure costuma ser associada a menor risco em SDRA?","Menor que 15 cmH2O","Maior que 25 cmH2O","Maior que 30 cmH2O","Independente da complacência","A","Correta. Valores menores associam-se a menor estresse alveolar.

Valor elevado.

Valor muito elevado.

Driving pressure depende da complacência."
"d1519ef5-9e12-4c43-b5bd-36be54aabb4a","ME3","Ventilação","3o Trimestre ME3 - Qual valor de pressão de platô geralmente deve ser evitado na ventilação protetora?","Menor que 20 cmH2O","Menor que 25 cmH2O","Maior que 30 cmH2O","Entre 15 e 20 cmH2O","C","Valor aceitável.

Valor aceitável.

Correta. Platô acima de 30 cmH2O aumenta risco de barotrauma.

Valor protetor."
"56d6f8ae-3d7b-4455-9eb1-d475efe407aa","ME3","Capnografia","3o Trimestre ME3 - Qual causa frequente de reinalação de CO2 no circuito circular?","Exaustão da cal sodada","Hiperventilação","Baixo metabolismo","Hipotermia","A","Correta. Absorvedor exaurido permite reinalação de CO2.

Reduz ETCO2.

Reduz produção de CO2.

Reduz produção metabólica de CO2."
"26b78a6e-8142-4a02-a4b8-0b43dc2ed8e0","ME3","DPOC","3o Trimestre ME3 - Em DPOC grave sob ventilação, qual estratégia reduz hiperinsuflação dinâmica?","Frequência respiratória elevada","Tempo expiratório prolongado","Tempo inspiratório prolongado","Hiperventilação intensa","B","Favorece aprisionamento.

Correta. Permite esvaziamento pulmonar mais completo.

Reduz tempo expiratório.

Pode piorar auto-PEEP."
"25b501d6-7323-4be5-9e42-75acb5d64ab2","ME3","Broncoespasmo","3o Trimestre ME3 - Em broncoespasmo intraoperatório grave, qual ajuste ventilatório é mais adequado?","Aumentar frequência respiratória","Reduzir tempo expiratório","Prolongar tempo expiratório","Aumentar volume corrente agressivamente","C","Piora auto-PEEP.

Aumenta aprisionamento aéreo.

Correta. Expiração prolongada reduz hiperinsuflação dinâmica.

Aumenta risco de barotrauma."
"b4264bfc-5f4c-4608-a8e1-e8bba537ba97","ME3","Ventilação","3o Trimestre ME3 - Em ventilação controlada a volume, aumento de pico com platô normal sugere:","Aumento de resistência de vias aéreas","Redução de complacência pulmonar","Pneumotórax hipertensivo sempre","Edema pulmonar cardiogênico","A","Correta. Resistência elevada aumenta pressão resistiva.

Aumentaria pico e platô.

Pode elevar ambos se reduzir complacência.

Geralmente aumenta platô também."
"5e99ead5-762a-44b9-a049-bbcfd2fda7ad","ME3","Capnografia","3o Trimestre ME3 - Qual alteração capnográfica sugere broncoespasmo?","Linha de base elevada","Curva em barbatana de tubarão","Traçado ausente","ETCO2 zero persistente","B","Sugere reinalação de CO2.

Correta. Esvaziamento expiratório lento altera a fase III.

Sugere desconexão ou extubação.

Incompatível com ventilação efetiva."
